job_url,site,title,company,company_url,location,job_type,date_posted,interval,min_amount,max_amount,currency,is_remote,num_urgent_words,benefits,emails,description,search_term
https://www.linkedin.com/jobs/view/3645684896,linkedin,Data Engineering Intern,Metyis,https://ch.linkedin.com/company/metyis,"Amsterdam, North Holland, Netherlands",internship,2023-11-24,,,,,,0,Actively Hiring,,"Who We AreWe are Metyis, a forward-thinking, global company that collaborates with business partners and clients to create and implement the capacities and capabilities required to improve future performance. We operate across a wide range of industries, and with our embedded partnership model we commit to driving sustainable growth for industry-leading organisations, elevating their potential with a long-term vision.At Metyis, we develop integrated solutions that enable growth by working within our business partners’ organisations with diverse and multidisciplinary teams. This collaborative environment allows Metyis to build strategies and execute them through an ecosystem that combines Big Data solutions, Digital Commerce solutions, Marketing & Design solutions, and Advisory services.Our teams are set up so that you have plenty of room to build bigger and bolder ideas by speaking your mind and being creative with your knowledge. Imagine the things you could achieve with a multidisciplinary team that encourages you to be the best version of yourself.We are Metyis. Partners for Impact.What We Offer3 months of intensive training from our super skilled Data engineering team on topics like data warehousing, data pipelines, distributed computing using Pyspark, data modelling & data lake.Followed by 3 months of relevant working experience on a live business case.Interact with clients regularly to drive their business towards impactful change.Play a key role in the team by creating new business solutions via data-driven insights.Receive guidance by a dedicated mentor to make sure you make the most out of your time at Metyis.Experience being part of a fast-growing international and diverse team.What you will doAssisting in the design, development, and maintenance of data pipelines to extract, transform and load data from various sources.Helping with data warehousing and data modelling activities.Participating in the creation of data-driven solutions to support business needs.Collaborating with data scientists, business analysts and software engineers to understand and implement data requirements.Implementing data quality and data governance processes.Participating in code reviews and providing constructive feedback.Staying up to date with the latest developments in data engineering technologies and best practices.What you’ll bringPursuing a degree in computer science, software engineering, or a related field.Strong programming skills in one or more programming languages such as Python, Java, or Scala..Strong analytical and problem-solving skills.Ability to work well in a team environment.Good communication and interpersonal skills.Passion for Data: A strong interest in data and technology, and a desire to learn and grow as a data engineer.",data analyst
https://www.linkedin.com/jobs/view/3770468021,linkedin,Data Analist,Nederland Vacature Groep,https://nl.linkedin.com/company/nederlandvacature.nl,"Boxtel, North Brabant, Netherlands",fulltime,2023-11-20,,3747,5490,€,,0,Be an early applicant,,"Taken en verantwoordelijkhedenAantal uren 32 - 38Data AnalistBij Vion Farming Benelux zijn we opzoek naar een Data Analist, maar wat houdt deze afdeling precies in?De afdeling Farming houdt zich onder andere bezig met de inkoop van levende dieren, het ontwikkelingen en mede invulling geven aan vraag gestuurde keten in de Nederlandse varkens- en rundvleessector. maar ook met bijvoorbeeld het optimaliseren van dierengezondheid. Daarnaast zorgt Farming voor de aanvoer van vleesvarkens, zeugen en slachtrunderen van het boerenerf naar de verschillende slachterijen van Vion in Nederland. Ook bemiddeling tussen de vermeerderaar en de varkenshouder en het begeleiden van dierstromen in de rundveehouderij (o.a. kalveren en fok- en gebruiksvee).Als Data Analist in het Farming-team ben jij de brug tussen bedrijfsvraagstukken en slimme data-oplossingen. In agile projecten werk je samen met diverse teams, van business stakeholders, data engineers tot developers.Je ontwikkelt en beheert heldere dashboards met KPI’s voor de farming-organisatie en zorgt voor nauwkeurige aanvoer forecasts. Daarnaast onderhoud je essentiële contacten met het MT Farming, de Planning farming, Accountmanagers, IM&T en de Vion Chain Innovation Hub. Jouw rol draagt bij aan de optimalisatie van de farming-performance in een dynamische markt.Je bent verantwoordelijk voorHet voorzien van juiste stuurinformatie aan business stakeholders in de Farming organisatieLink met de IM&T organisatie, zorgen dat op de juiste manier ontsloten worden uit bronsystemenHet volgen en ontwikkelen van data standaardenAlle dashboards en andere tools onderhoudenOndersteunen bij het in kaart brengen, refinen, beheren en implementeren van alle projecten met een data componentHet uitvoeren van analyses in opdracht van business stakeholdersHet werken volgens Agile principesProfiel kandidaatWat verwachten we van jou?Je hebt WO werk- en denkniveau.In het bezit van een afgeronde Master in (Toegepaste) Wiskunde, Econometrie, Data analytics, of vergelijkbaar.Je hebt minimaal 3 jaar aantoonbare werkervaring in een soortgelijke functie.Je hebt Logisch en analytisch denkvermogen.Je werkt oplossingsgericht.Je bent Flexibel ingesteld.Communicatief ben je sterk, besluitvaardig en een teamplayer.Klantgericht werken is een vanzelfsprekendheid.Je hebt kennis van Python, SPSS, R, PowerBI, SQL, en andere data visualisatietools.Engels op professioneel niveau.Wat kan je van ons verwachten?We starten met een jaarcontract met de intentie deze om te zetten naar een vaste baan.Een marktconform salaris tussen de €3747,- en €5490,- per maand passend bij jouw kennis en ervaring.24 vakantiedagen.Naast het salaris ontvang je uiteraard 8% vakantiegeld en een eindejaarsuitkering van 2%.Het betreft een functie voor 38 uur per week.Mogelijkheid om hybride te werken en de tijden flexibel in te delen.Onbeperkt toegang tot de Vion Academy met wel meer dan 600 verschillende trainingen en cursussen voor jouw eigen persoonlijke ontwikkeling en groei.Mogelijkheden voor het doen van externe opleidingen voor jouw eigen persoonlijke ontwikkeling en groei.Vion kent diverse interessante werknemers regelingen, zoals forse korting op onze producten en een collectieve zorgverzekering.Heb je interesse? Solliciteer dan via onderstaande knop.Wil je meer weten, neem dan contact op met Jan-Willem Westen via 06-81119129",data analyst
https://www.linkedin.com/jobs/view/3773261926,linkedin,Business Intelligence Consultant,PW Consulting,https://nl.linkedin.com/company/pw-consulting,"Culemborg, Gelderland, Netherlands",fulltime,,,,,,,0,Be an early applicant,,"Ben jij de Business Intelligence Consultant die organisaties helpt te transformeren met behulp van data?Wil jij weten wat er komt kijken bij CO2-reductie binnen een gemeente? Of ben je benieuwd naar welke data verzameld wordt voor de Nederlandse waterwegen? En hoe denk je dat analytics in ziekenhuizen wordt toegepast om de zorg in Nederland te verbeteren?Wil jij je met dit soort vraagstukken bezig houden, dan is PW Consulting dé plek voor jou!FunctieomschrijvingJij bent die nieuwsgierige consultant die graag analytisch en creatief bezig is en zich wil blijven ontwikkelen in de wereld van data en informatie.Als consultant werk je bij verschillende soorten opdrachtgevers. Jij helpt hen om verder te komen als het gaat om data engineering, analyses, rapportages en visualisatie. Elke klantvraag is anders en geen opdracht is hetzelfde, je doet nieuwe kennis op in elke omgeving waar je werkt.Bij onze klanten werk je veel samen met zowel business als IT. Als consultant van PW ben je een belangrijk onderdeel van het team waarin je komt te werken. Je werkt vaak in multidisciplinaire teams - samenwerken en communiceren gaat je dan ook gemakkelijk af.Wij vragenJij bent die nieuwsgierige consultant die graag analytisch en creatief bezig is en zich wil blijven ontwikkelen in de wereld van data en informatie.Als consultant werk je bij verschillende soorten opdrachtgevers. Jij helpt hen om verder te komen als het gaat om data engineering, analyses, rapportages en visualisatie. Elke klantvraag is anders en geen opdracht is hetzelfde, je doet nieuwe kennis op in elke omgeving waar je werkt.Bij onze klanten werk je veel samen met zowel business als IT. Als consultant van PW ben je een belangrijk onderdeel van het team waarin je komt te werken. Je werkt vaak in multidisciplinaire teams - samenwerken en communiceren gaat je dan ook gemakkelijk af.Wij biedenBij PW kun je rekenen op een interessante functie met diverse in- en externe opleidingstrajecten, die we inzetten al naar gelang jouw behoeften. Je staat in nauw contact met gemotiveerde collega’s met veel kennis, die graag van elkaar leren en elkaar bij complexe vraagstukken ondersteunen.Verder bieden wij het volgende; uitstekende mogelijkheden om jezelf te ontwikkelen en ontplooien, zowel vakinhoudelijk als persoonlijk, waarbij trainingen en opleidingen voornamelijk onder werktijd plaatsvinden. een passend, marktconform salaris een leaseauto of mobiliteitsregeling een laptop en een mobiele telefoon een pensioen welke je deels zelf kunt beïnvloeden een bonus, gekoppeld aan je inzet bij onze klanten winstdeling flexibel werken qua uren en locatie (afhankelijk van je opdracht) flexibele arbeidsduur, bijv. 36 uur per week, aan te passen naar meer of minder veel mogelijkheden om je collega’s goed te leren kennen, bijvoorbeeld door bijeenkomsten, congresbezoek en een paar keer per jaar een social event waarbij je levenspartner ook welkom is. 28 vakantiedagen (bij fulltime dienstverband)Over PW Consulting B.V.PW Consulting is opgericht in 1988 en is gespecialiseerd in business intelligence en analytics.Onze klanten zijn Nederlandse top-100 ondernemingen in financiële dienstverlening, overheid, industrie, gezondheidszorg, farmacie en zakelijke dienstverlening.Wij hebben persoonlijke ontwikkeling en betrokkenheid hoog in het vaandel staan. Bij PW staan collega’s als mens centraal en ben je niet alleen een werknemer.Met 70 hoogopgeleide professionals helpen wij organisaties om optimaal te profiteren van data en voegen we waarde toe aan hun bedrijfsvoering. Onze werkwijze hierbij is toegankelijk, transparant en objectief. Vanuit een steeds breder wordende scope aan dienstverlening ontwerpen, analyseren, ontwikkelen en beheren wij bij onze klanten. Daarnaast adviseren wij onze klanten over het bereiken van hun tactische en strategische doelen.Hoe nu verder?Ben jij geinteresseerd in bovenstaand profiel voor Business Intelligence Consultant? PW Consulting B.V. ziet graag jouw sollicitatie tegemoet! Door middel van het klikken op de solliciteerbutton kom je in een overzichtelijk sollicitatiescherm waar je met jouw CV kan reageren op de vacature van Business Intelligence Consultant.",data analyst
https://www.linkedin.com/jobs/view/3663414871,linkedin,Data Analyst,Leap29,https://uk.linkedin.com/company/leap29,"Eindhoven, North Brabant, Netherlands",fulltime,2023-07-14,,,,,,0,Actively Hiring,dguinnane@leap29.com,"A Data Analyst is required for my client who work within the food industry. It is an exciting opportunity to work with a massive client on a annual contract with the intention to turn into a permanent role. To apply for this role, you must be fluent in Dutch & English.You will act as the middleman between the business stakeholders and the development team, Data engineers, Data modelers and Front-end specialists. You will work in an Active environment where you discuss requirements with business stakeholders, translate them into solution designs, plan the deliverables, and work as part of the development team towards a successful result. You will perform exploratory data analysis,identify, and perform data quality checks.Requirements2+ years’ experience as a Data Analyst.Knowledge of SQL, Python, Microsoft Azure and data visualization tools.Have experience communicating clearly in both English & Dutch both in speech and writing.You have experience solving and structuring both conceptual and concrete problems.You must have strong analytical skills.ResponsibilitiesYou will regulate, optimize and safeguard the processes and dashboard functionalities like designs, scripting, presentation choices, test findings, availability and authorizations in collaboration with the BI Team.You will Analyse onboarded datasets to identify inconsistencies and proactively resolve data issues.Communicate findings and recommendations to stakeholders in a clear and concise manner.You will gather requirements in the business for dashboards / reports and translate them into appropriate solution designs;What They OfferHighly competitive Salary - DOEEnd of year Bonus.Award winning training and development.Health InsuranceOpportunities for external training for your own personal development and growth.This is an exciting opportunity for a data analyst to join a leading company. If joining a company where you get a personal career development track, a substantial training budget, and regular training sessions sounds like a company you would be interested in, please apply with your full CV or drop me an email on dguinnane@leap29.com",data analyst
https://www.linkedin.com/jobs/view/3771609756,linkedin,"Data analist, Houten",Work-on,https://nl.linkedin.com/company/workon-bemiddelingsbureau,"Houten, Utrecht, Netherlands",fulltime,2023-11-22,,,,,,0,Be an early applicant,,"VacaturebeschrijvingAls starter vechten je dromen en ambities om voorrang en dan lijkt het een voordeel dat de vacatures momenteel als paddenstoelen uit de grond schieten. Al doen al die mogelijkheden je misschien ook twijfelen aan wat de beste keuze voor je is. Ben je analytisch aangelegd en zit het met je nieuwsgierigheid wel goed? Dan kan het zomaar zijn dat een keuze voor een rol als data analist jou helemaal past.Al doe ik met die korte intro de functie zelf te weinig eer aan. Ja, het analyseren van data staat centraal, maar voor het verhaal van iedere klant en het bijstaan van je collega's heb je evenveel aandacht. Aan de hand van je ondernemende karakter onderzoek je welke in- en externe operationele processen spelen bij de klant. Is dat in kaart, volgt de analyse om uit te komen bij de optimalisaties en hoe deze uit te voeren. Wat je tussen de regels door leest? Aan verantwoordelijkheid geen gebrek. Sterker nog: je krijgt alle kans om te leren en op verschillende vlakken echt het verschil te maken voor de klant. Geen gespreide bedjes om in te stappen dus, maar elke keer nieuwe paden bewandelen en jezelf uitdagen om tot de juiste formule te komen. Waar kom jij te werken?Jij treft jouw nieuwe 'thuisbasis' aan in Houten. Om precies te zijn bij een opdrachtgever die zich met recht een specialist mag noemen op het gebied van wagenparkbeheer en mobiliteitsmanagement. Alle zaken zo goed regelen, dat iedere klant eigenlijk vergeet dat ze over een wagenpark beschikken. Dat is waar men hier dagelijks op stuurt. Ga je hier aan de slag, krijg je er totaal zo'n 3 goedgevulde VW Polo's aan collega's bij. Allemaal met hun eigen passie voor het vak. En hoewel iedereen zijn eigen verantwoordelijkheden heeft staat het teambelang hier zeker op de kaart. Van inhoudelijke kwesties tot beleefde avonturen in het weekend, niets blijft onderling onbesproken.Echt samen gas geven dus. Een formule die alleen werkt wanneer er onderweg genoeg tijd wordt gemaakt voor onderlinge gezelligheid. Bijvoorbeeld tijdens een van de vele teamuitjes. Deze komen dan ook geregeld voorbij. Hoe ziet jouw werkdag eruit?09:00 uur: na een korte dagstart met je team duik jij direct in je mailbox. Zijn er zaken die direct opgepakt moeten worden?10:00 uur: meerdere fleetmanagers weten de weg naar jou te vinden. Je helpt ze graag aan een antwoord op hun vragen en bent tussendoor bezig met het updaten van de huidige beheertool 12:15 uur: tijd voor een lekkere lunch en een wandeling buiten. Het zonnetje schijnt dus je collega's haken gezellig aan 13:30 uur: je middag staat in het teken van een klantbezoek om te inventariseren welke operationele zaken hier spelen. Pas bij het hebben van een volledig beeld bij een nulmeting is het mogelijk om na te gaan denken over optimalisaties 15:15 uur: de laatste uurtjes van je dag gaan op aan het uitvoeren van een controle op de volledigheid en betrouwbaarheid van alle ingevoerde gegevens in de beheertool17:15 uur: op naar huis (of slechts je laptop dicht doen) met een voldaan gevoel ;)Herken jij jezelf hierin?Kijk Jij In Je Achteruitkijkspiegel, Zie Jij Iemand Dieeen hbo diploma op zak heeftfulltime beschikbaar is bekend staat als gedreven, detailgericht en leergierigwoont op woon- werkafstand van Houtensnel schakelt, data driven en analytisch sterk isvoor een klant graag nog net een versnelling harder gaat PS: heb je een passie voor alles wat rijdt en ervaring binnen leasing? Dan scoor je bonuspunten. Wat krijg je ervoor terug?Eenmaal Onderweg Ben Jij O.a. Zeker Vandirect een contract bij de opdrachtgevereen lekker salaris vanaf €2750.- bruto per maandminimaal 25 vakantiedagen per jaareen bonus resultaatafhankelijk is de mogelijkheid om (deels) vanuit huis te werkenvergoeding van je reiskosten wanneer je deze maakt En? Ben jij klaar om hier eens goed gas te komen geven? Solliciteer direct en dan zorgen we samen zo snel mogelijk voor groen licht! Solliciteren kan via de sollicitatiebutton, door je cv te mailen via de button ""Solliciteer nu"" op deze pagina. of te bellen naar 030 636 50 09.5cd8a0b9cc68f9ffa4c9253553278a55wer",data analyst
https://www.linkedin.com/jobs/view/3750245526,linkedin,Junior Data Analist,Veneficus - Factual decision making,https://nl.linkedin.com/company/veneficus,"Rotterdam, South Holland, Netherlands",fulltime,2023-11-17,,,,,,0,,femke.frowijn@veneficus.nl,"StandplaatsRotterdamAantal uur40Salarisindicatie€ 2600 tot € 3000,-Wat ga je doen ? Je maakt het verschil bij een van onze opdrachtgevers in de functie van Data-analist;Je volgt inhoudelijke trainingen op het gebied van data gegeven door een technische trainer met ruime praktijkervaring;Je neemt deel aan de soft skill trainingen om je sociale en communicatieve vaardigheden te ontwikkelen. Dit doen we bijvoorbeeld tijdens een weekend weg op een mooie locatie;Je spreekt regelmatig met je Learning Consultant en Personal Coach in het kader van jouw leerplan;Als jij en je opdrachtgever na de inzetperiode nog steeds enthousiast van elkaar worden, dan is er de mogelijkheid om in dienst te treden bij de opdrachtgever.Join the data revolution en solliciteer nu ! Veneficus. Optimizing Intelligence. Wij geloven in het optimaliseren van intelligentie. We ondersteunen beslissers om het verschil te maken door de kracht van data te benutten. Ons doel is om data en business samen te brengen met de perfecte mix van magie en logica.We streven naar perfecte flows, grotere groei, slimmer werken en bovenal een gelukkiger leven. We willen jou helpen om jouw potentieel te benutten en een impact te maken op de wereld van data.Hoe ziet jouw dag eruit ? Tijdens het interne trainingsprogramma ontdekken we samen waar jouw krachten liggen. Welke functie en welk type bedrijf bij jou past, onderzoeken we dan ook samen aan de hand van de resultaten die jij boekt en de coachingssessies die we houden. Zo zorgen we altijd dat jij bij een opdrachtgever start die past bij jouw behoeften en ambities. Om je een idee te geven: momenteel werken wij veel samen met bedrijven binnen de financiële wereld zoals banken en verzekeraars, de logistiek, de retail en het vastgoed. Samen met een Learning Consultant en een Personal Coach maak jij een persoonlijk leerplan en word je maandelijks begeleid in het halen van je leerdoelen. Uiteraard kun je hierbij volop gebruik maken van onze interne Academy en deelnemen aan diverse intervisiesessies. Zo halen we gezamenlijk het beste uit jou als startende Data-analistOver jouWie ben jij ? Je bent een enthousiaste, leergierige en toekomstgerichte afgestudeerde die zijn of haar carrière vliegend wil starten. Je wilt graag het beste uit jezelf halen en zoekt een werkgever die je daar als geen ander bij kan ondersteunen.Praktisch Vragen WijEen afgeronde Hbo- of Wo-opleiding (bij voorkeur een beta richting);Enige ervaring met een moderne programmeertaal zoals Matlab, Python of R;Sterke affiniteit met het datavakgebied;Je bent leergierig en altijd bezig met je eigen ontwikkeling, zowel op professioneel als persoonlijk vlak;Je bent niet bang om in het diepe te springen;Flexibel inzetbaar en woonachtig in de Randstad of bereid om daar naartoe te verhuizen;Je beheerst de Nederlandse taal uitstekend.Over onsWat bieden wij jou ? Een traineeship met volop ruimte om je te ontwikkelen als Data Specialist;Direct een vast contract met een basissalaris van € 2600 bruto per maand;25 vakantiedagen o.b.v. fulltime;Een thuiswerk vergoeding van € 50 netto o.b.v. fulltime en 8% vakantiegeld;Bonussen en salarisverhogingen die passen bij de snelle ontwikkeling die jij doormaakt;Pensioen opbouw via STIPP en aanvullende verzekering bij langdurige ziekte;Een NS-Businesscard en eventueel een Swapfiets;Een laptop en alles voor een goede thuiswerkplek;De mogelijkheid om te werken waar je wil (hybride) en zelfs in goed overleg remote;Een vrijwilligersdag, een dag waarop je jouw steentje kan bijdragen aan onze maatschappij in een vorm die bij jou past!Veel aandacht en ruimte voor jouw persoonlijke ontwikkeling door een ontwikkelpad waarbij zowel technische skills als soft skills centraal staan;Regelmatige terugkom dagen, borrels en gezellige team uitjes!Wil je meer weten over deze functie of onze organisatie? Neem dan contact op met onze recruiter Femke. Je kunt haar bereiken op 0636181321 of femke.frowijn@veneficus.nl .Delen?Acquisitie op basis van deze vacature stellen wij niet op prijs.",data analyst
https://www.linkedin.com/jobs/view/3754277993,linkedin,Data Engineer,Inergy,https://nl.linkedin.com/company/inergy-1,"Woerden, Utrecht, Netherlands",fulltime,2023-10-30,,,,,,0,Actively Hiring,,"Ben jij een ervaren Data Engineer die enthousiast wordt van het bouwen van complexe dataplatformen? En heb jij expertise op het gebied van Azure Data Factory, Azure, SQL en ETL? Dan is Inergy op zoek naar jou! Als Data Engineer binnen Inergy verdiep jij je in dataplatformen bij klanten zoals Rituals, PostNL en Detailresult Groep. Je bouwt niet alleen datawarehouses, maar denkt ook mee over het ontwerp en de implementatie van deze dataplatformen.Let's playOm onze opdrachten zo effectief mogelijk te vervullen, werken wij in teamverband voor onze klanten. Hierdoor heb je altijd mensen om je heen om mee te sparren, en kom je in de gelegenheid om kennis te delen en te vergaren!Ook zorgen wij ervoor dat je je kunt blijven ontwikkelen doordat we werken met de nieuwste technieken en hierin constant op zoek zijn naar vernieuwing. Daarnaast waarderen wij binnen Inergy een mooie balans tussen werk en privé.CreateWij hebben een Microsoft first strategie en focussen ons initieel op de Microsoft Azure Cloud en Snowflake. Focus is één van onze kernwaarden en zorgt ervoor dat wij het beste in elkaar naar boven halen. Door dit te doen realiseren wij de meest uitdagende dataplatformen voor onze klanten.Grow togetherOm samen te groeien en succesvol te zijn, bieden wij een persoonlijk leiderschapsprogramma en creëren wij interne doorgroeimogelijkheden.Wie ben jij:Je hebt minimaal 5 jaar ervaring in ETL en SQL.Je hebt kennis van BI toolingen visualisatie zoals Power BI, Tableau of Microstrategy en modelleermethodieken.Je hebt kennis van Microsoft Azure en Azure Data Factory.Je spreekt de Nederlandse taal vloeiend.Snowflake ervaring is erg mooi meegenomen.Je bent proactief, leergierig, analytisch en klantgericht.Wat bieden wij:Een salaris tot aan €6.500,- per maand, wat wordt bepaald aan de hand van je kennis en ervaring.25 vakantiedagen (met de mogelijkheid om dagen te kopen/verkopen).Flexibiliteit rondom je werklocatie: gezonde mix tussen werken bij de klant, op kantoor en vanuit huis.(Gedeeltelijke) vergoeding voor de inrichting van je thuiswerkplek.Laptop en telefoon van de zaak.Keuze uit een Lease-auto of Mobiliteitsbudget.Bij Inergy geloven wij dat je werk niet op één locatie hoeft te zijn, maar op de plek die voor jou goed voelt! Of dit nou thuis, vanuit het buitenland, een flexplek of kantoor is, alles is mogelijk! Wel zorgen wij dat zodra jij op kantoor bent er een heerlijke verse (gratis) lunch voor je klaar staat en je gratis kan sporten.",data analyst
