job_url,site,title,company,company_url,location,job_type,date_posted,interval,min_amount,max_amount,currency,is_remote,num_urgent_words,benefits,emails,description,search_term
https://www.linkedin.com/jobs/view/3772012736,linkedin,Senior Analytics Engineer,Vattenfall,https://se.linkedin.com/company/vattenfall,"Amsterdam, North Holland, Netherlands",fulltime,2023-11-23,,,,,,0,Be an early applicant,tessa.beerling@vattenfall.com.Bij,"Over de functieWil je bijdragen aan de energietransitie en een duurzame wereld? En geeft het ontwikkelen van op data gebaseerde zakelijke oplossingen jou energie? Sluit je dan aan bij ons Data & Analytics team als Analytics Engineer!Over de Data & Analytics afdelingJe zult deel uitmaken van de Vattenfall BtC (Business to Consumer) Data & Analytics afdeling, die op data gebaseerde oplossingen ontwikkelt voor onze klanten en klantprocessen. De afdeling is verdeeld in drie teams voor verschillende bedrijfsdomeinen; waar data-experts en zakelijke experts nauw samenwerken om waardevolle data science-oplossingen te realiseren. Elk Data & Analytics domein team bestaat uit een Analytics Translator, Analytics Engineers en Data Scientists, en wordt ondersteund door Data- & Machine Learning Engineers van IT.De afdeling werkt verdeeld in drie teams voor verschillende bedrijfsdomeinen; waar data-experts en zakelijke experts nauw samenwerken om waardevolle data-oplossingen te realiseren. Elk domein team bestaat uit een Analytics Translator, Analytics Engineers en Data Scientists, en wordt ondersteund door Data & Machine Learning Engineers van onze IT (Informatie Technologie) afdeling.We hechten waarde aan gezamenlijke ontwikkeling in manieren van werken en het delen van best practices. Dit wordt gefaciliteerd in onze data science autoriteit en data foundation autoriteit. Als Senior Analytics Engineer lever je een belangrijke bijdrage aan de Data Foundation autoriteit.Jouw rol Als Senior Analytics Engineer weet je hoe je de wensen van onze stakeholders kunt vertalen naar de juiste inzichten uit data. Je bent bekend met de beschikbare data bronnen op ons platform en hebt proactieve ideeën voor aanvullende bronnen die ons beter van dienst zouden zijn. Samen met relevante stakeholders stem je af en creëer je de nodige data definities. Je bent een expert als het gaat om data modellering. Je kent de voor- en nadelen van alternatieve oplossingen en zoekt naar de beste aanpak in elke situatie. Je creëert relevante datasets en dashboards en coacht gebruikers over hoe ze deze kunnen gebruiken. Je bent een actief lid van de data foundation autoriteit; voortdurend op zoek naar manieren om onze data producten naar een hoger niveau te tillen. Dit kan bijvoorbeeld worden gedaan door afstemming met je collega's over verbeterde standaarden, het toevoegen van nieuwe functionaliteiten voor eindgebruikers of het delen van nieuwe kennis met alle analytics engineers. Je brengt je enthousiasme over data over op de organisatie. In deze functie krijg je de kans om met innovatieve technologieën te werken en een impact te maken!Jouw taken en verantwoordelijkheden:Vertaal de wensen van stakeholders naar duidelijke vereisten voor data producten. Creëer bruikbare inzichten voor verschillende stakeholders. Ontwikkel datasets en dashboards die gebruikers in staat stellen om hun vragen te beantwoorden. Leg op een eenvoudige manier uit hoe datasets en dashboards geïnterpreteerd en gebruikt kunnen worden door verschillende stakeholders. Breng enthousiasme over data over om de organisatie te inspireren en te betrekken. Benut data om trends, patronen en kansen voor bedrijfsgroei te identificeren. Werk samen met het team om het data model van de organisatie te verbeteren en data producten te verbeteren. Blijf op de hoogte van innovatieve technologieën op het gebied van data-analyse en gebruik ze om impact te genereren. Speel een cruciale rol in de ontwikkeling en implementatie van data oplossingen voor Vattenfall BtC. Locatie: AmsterdamJouw profielJouw profiel Als Senior Analytics Engineer ben je een sterke communicator en enthousiaste collega met een passie voor data. Je voelt je op je gemak in een breed stakeholder veld. Je bent analytisch, resultaatgericht en werkt graag in een wendbaar team. Daarnaast ben je proactief op zoek naar nieuwe oplossingen en standaarden om mee te werken.Daarnaast voldoe je aan de volgende criteria:Een afgeronde HBO/WO-opleiding. Minimaal 7 jaar ervaring in een vergelijkbare rol. Meerdere jaren ervaring in een omgeving met grote hoeveelheden data. Zeer sterke Transact-SQL-vaardigheden. Ervaren professional als het gaat om Data Modeling en Dimensional Modeling. Sterke rapportagevaardigheden met Microsoft Power BI of vergelijkbare tools. Gewend om te werken met CICD, testen en code-reviews. Ervaring met de Agile manier van werken - Scrum. Gewend om te werken aan grote projecten of met een breed stakeholder veld. Extra informatieWij bieden Wij bieden je naast een marktconform salaris goede secundaire arbeidsvoorwaarden, die je zelf voor een deel kunt samenstellen. Ook zijn er veel mogelijkheden je vakinhoudelijk en persoonlijk te ontwikkelen.Daarnaast kom je terecht in een moderne, dynamische en plezierige werkomgeving. Bij Vattenfall heerst een hechte teamcultuur waar tegelijkertijd volop ruimte is voor eigen initiatief.Standplaats van deze functie is Amsterdam, hybride werken is op dit moment de norm. We hechten bij Vattenfall veel waarde aan een goede werk-privé balans, wij blijven dus samen kijken hoe wij hier als werkgever aan bij kunnen dragen.Solliciteren / Meer weten? Klinkt dit interessant? We zien jouw sollicitatie graag uiterlijk 7 december tegemoet. Voor vragen over de functie en/of het proces kun je contact opnemen met Tessa Beerling, Corporate Recruiter, tessa.beerling@vattenfall.com.Bij Vattenfall zijn wij ervan overtuigd dat diversiteit een grote bijdrage levert aan onze organisatie. Daarom streven wij constant naar een harmonieuze balans tussen onze medewerkers op het gebied van leeftijd, seksuele geaardheid, geloofsovertuiging, genderidentiteit, (arbeids)beperking en culturele of etnische achtergrond.De veiligheid van Vattenfall en haar medewerkers is essentieel. Daarom maakt een pre-employment screening deel uit van het selectieproces. De screening is gebaseerd op de rol die je gaat vervullen binnen Vattenfall. De screening wordt uitgevoerd door een derde partij, Validata.We kijken uit naar je sollicitatie!Over onsVattenfall is een Europees energiebedrijf met ongeveer 20.000 werknemers werkzaam in diverse landen. Al meer dan 100 jaar houden we ons bezig met het electrificeren van industrieën, het leveren van energie aan de huizen van mensen en het moderniseren van onze manier van leven door innovatie en samenwerking. Vattenfall wil een fossielvrij leven mogelijk maken binnen één generatie. We lopen voorop in de transitie naar een duurzaam energiesysteem. Om dit ambitieuze doel te kunnen bereiken zijn wij op zoek naar getalenteerde personen die naast hun passie voor hun eigen rol ook een sterke teamspirit hebben en willen bijdragen aan het ondersteunen van een betekenisvolle bedrijfsmissie.",analytics engineer
https://www.linkedin.com/jobs/view/3764321065,linkedin,Junior Data Engineer – Young Engineering Professional Program,Rabobank,https://nl.linkedin.com/company/rabobank,"Utrecht, Utrecht, Netherlands",fulltime,2023-11-22,,,,,,1,Actively Hiring,Clemens.schinkel@rabobank.nl,"Interested in a job in IT and contributing to a better world? Discover your best self with the Young Engineering Professional Program.You and your futureDuring the Young Engineering Professional Program (also known as YEPP) at Rabobank you work on your career one day a week by following a technical track, or you work on your personal development. You develop talents you didn’t know you had and we are given the space to discover for yourself what you are good at and what you like. And then? Everything you learn in the training courses can immediately be put into practice, because the other 4 days you work in your starter position as a Junior Data Engineer. Under the guidance of experienced colleagues, you will become a specialist in your field in no time. In addition, in the program you will work together with the team on 2 business challenges on themes such as sustainable agriculture or the cooperative energy transition.In the Working Capital & Trade Finance area you will help Rabobank to become ""The global F&A connector"" in the integrated value chain. You will develop a platform where we can plot prospects and clients in the value chains and can directly see the peer analyses with the main competitors. By creating such automated insights into the client’s working capital scenarios, including benchmarking and peer group comparisons, we can add value to the interaction with our clients which can make the difference in a pitch.ExamplesKeep the data model aligned with business interests by adding, updating or deleting elementsCombine data analysis with visualizations to create insights in the Client’s working capital position and insights in relevant impacts in relation to industry, geography, rules/regulations, weather etc. Develop data ingestion pipelines and data structuring through the use of Azure Databricks and Azure DataFactoryEnsure that our code (infrastructure as code, ELT logic) always stays up to date and reliable.Safeguard the security of the data and processes we have to prevent potential damagePracticalLength: Young Engineering Professional Program: 18 monthsAfter which you will continue to work with us as Junior Data EngineerHours per week: 40Your development To become the specialist in your professional field, in the Young Engineering Professional Program 1 day a week you mainly attend training courses that that support your talent development. The courses are often given by experienced colleagues or trainers with a track record. You build your network, gain valuable experience and develop skills which will be of use to you later in your career.Learning From Each OtherDevelopment is our top priority. Because the best way to learn is by doing, through mistakes and successes. At Rabobank we offer you the right balance between freedom and supervision. To develop talents you never thought you possessed. To specialize in a professional field or explore the things you're good at and enjoy doing. During the Young Engineering Professional Program you can count on us for excellent supervision. You'll work with experienced colleagues and have lots of contact with young professionals.“YEPP provided a great place to learn IT while gaining insights into Rabobank and it's way of working. I have been able to strengthen my existing IT skills, and learn about new topics with a strong network of other young professionals to share with.” - Alastair Grant, YEPP Developer VCV.Talking of Rabobank: We are a Dutch bank that operates in 38 countries for over 9,500,000 customers. Together with these customers, our members and partners we stand side by side to create a world in which everyone has access to enough healthy food. In the Netherlands we work to create a country in which people are happy with how they live, work and do business.You and your talenta bachelor or master degree, or an equivalent working / thinking levelaffinity with software development, and already some experience with dataexcellent proficiency in Englishfeedback makes you strongerlearns from mistakesadaptive to changing situationsfocus on the solutionThis Is What We Offer YouMost of all, we offer you an 18 month long rich learning experience, while you advance your career towards an expert in your fieldA gross monthly salary in function scale 7A combination of working from home and at the officeA personal development budget of € 1,400-This is a selection of the terms of employment for a Junior Data Engineer based on a 40-hour working week.You and the job application processWe believe in the power of difference. Bringing together people's differences is what makes us an even better bank. What can you bring to Rabobank? We can't wait to hear from you.So get in touch straightaway:Any questions about working at Rabobank and the process? Contact Clemens Schinkel, Corporate Recruiter via Clemens.schinkel@rabobank.nl.A technical assessment and/or a personality assessment is part of the selection process.Interviews will be held via MS Teams or at our office in Utrecht.A security check is part of the process.We respect your privacy.",analytics engineer
https://www.linkedin.com/jobs/view/3763898513,linkedin,Jr Machine Learning Ops Engineer,Albert Heijn,https://nl.linkedin.com/company/albert-heijn,"Zaandam, North Holland, Netherlands",fulltime,2023-11-22,,,,,,0,Actively Hiring,peter.dirks@ah.nl,"Op het hoofdkantoorBij Albert Heijn werken is niet zomaar een baan. Het is werk met betekenis. Je werkt in een informele cultuur samen met een bevlogen team dat graag voorop wil blijven lopen en verschil wil maken. Met jouw unieke talent maak je impact op het leven van al onze klanten. Je leert van experts in hun vakgebied en we helpen je jouw loopbaan vorm te geven. Je kunt bij ons flexibel werken, zowel vanuit huis als op ons hoofdkantoor in Zaandam. Een baan bij Albert Heijn is niet alleen een baan voor nu, maar ook voor laterWat betekent dit voor jou?You’re finished work for the day, you’ve pushed your code, and it’s been reviewed and merged, you need to pick up some groceries on the way home. You bike to your local Albert Heijn and you think to yourself with a smile that the forecasting model that you and your team just deployed is already running behind the scenes to make sure that your favorite products are fresh and available! As you walk through the refrigerated aisles you pick up a bargain - some salad leaves that have been dynamically marked down to 70% off to make sure they sell before they expire and are wasted – again by a data science model running behind the scenes. You walk past the bakery department and think about the optimization that is running to help the bakers bake the right number of croissants tomorrow morning. Stepping out onto the street you think to yourself that it’s not just your local store – these models are running in more than a thousand stores across the Netherlands and Belgium. Furthermore, it’s not just the stores, the models your team builds are running in the supply chain and for online orders – ensuring efficient packing and delivery!Does a job with such tangible impact at such scale motivate you? Do you want to use your skills to solve a wide set of practical and challenging problems?We're looking for talented curious young people to come and strengthen our Operations Analytics and Data Science team!As a Junior Machine Learning Engineer at AH Technology, you will:Work on different aspects of our in-house machine learning solutions including software engineering, data engineering and automationCollaborate with product owners, analysts, data scientists and engineers to deploy and continually improve machine learning modelsSupport the team in following software engineering and MLOps best practices, for example by reviewing code and automating deployment and model management tasksContinually improve your coding and machine learning skills with the guidance of senior members and through participation in trainingWho you are:You have an MSc in Computer Science, Artificial Intelligence, Data Science, or a related disciplineYou enjoy writing pythonic, clear, extendable, testable code, and can apply Software Engineering best practicesYou can build a data pipeline using SQL, Spark, Pandas, or other relevant tools for transformation of relational dataYou are familiar with the concepts of version control and continuous integration and deliveryYou know the fundamentals of Machine Learning and StatisticsKnowledge of the following topics would be a plus:ContainerizationCloud platformsREST APIsFor more information about AH Technology, you can also visit https://blog.ah.technology/At AH Technology, we aim to grow, and that is only possible if you grow with us.That is why you get access to best-in-class guidance and inspiring training to shape your development and career.As we work together to build on our brand and your career, you can count on (based on 40 hours per week):An inspiring head office in ZaandamA competitive salary up to € 60K - gross a year. (excl. holiday allowance)A profit distribution on top of your salary25,5 vacation daysAn ADV budget choice in which you can decide whether you spend it on extra days (+19,5 days), discounts or pay-outsFlexible working hours and the possibility to work from homeAn excellent pension plan with a personal contribution of 6.2%Courses from our Albert Heijn Data AcademyAttractive discounts on various insurance policiesA travel allowance or a Traject OV-chip card for traveling to and from ZaandamA MacBook M1/M2 Pro and iPhone 1410% discount on your grocery shopping in our Albert Heijn stores, up to € 300 per yearData Talent TrackLearning and personal growth are core values of our department. Our Data Talent Track is a one and a half year program available to our young analysts and data scientists. It consists of soft and hard skills training that helps you develop your professional skills. Courses on communication, on personal leadership and on writing better code. You’ll also get a chance to help out in the store for a day or help build the ideas of the future in a Hackathon.Want to know more?Follow this link: https://nl.linkedin.com/posts/noortje-van-genugten_ahtechnology-dataanalytics-albertheijn-activity-7062341484271792128-9AK0ApplyDo you want to play an active role in changing the food retail landscape as we know it? Then hop on board and join us on our expedition. Apply via the button on this page. We ask you not to send a standard motivation letter, but to formulate an answer to the following questions:Why do you think you will be successful in this position and what kind of technical skills do you bring with you for this role?What is one of your personal strengths and one skill you wish to improve or develop?Want to know more before you apply for our role at AH Technology? Peter Dirks, Talent Acquisition Partner Data Science & Analytics, is happy to tell you everything about this vacancy via peter.dirks@ah.nl",analytics engineer
https://www.linkedin.com/jobs/view/3755070327,linkedin,Senior Data engineer,Eneco,https://nl.linkedin.com/company/eneco,"Rotterdam, South Holland, Netherlands",fulltime,2023-11-09,,,,,,0,Actively Hiring,,"Data 3-5 jaar/years Eneco - Rotterdam €70.000 - €90.000 32 - 40 uur Solliciteer directYou will have the opportunity to work on complex ingestion issues with cutting-edge technologies such as Azure Data Factory, Kubernetes, Snowflake.You will become part of the frontrunner in the energy transition, where you contribute to a more sustainable future by building on the growth and development of Eneco's integration platforms.You get the opportunity to make Eneco a digital first company.Why choose for Eneco?Why choose Eneco? We want to accelerate the energy transition. With our ambitious ‘One Planet plan’, we have made it clear that by 2035, we aim to be the first energy company to become CO2-neutral. No more reliance on natural gas! The entire Netherlands is making the switch. Towards smarter, cleaner, and more sustainable energy. Everyone has their own reasons for doing so. Some want to contribute to a better climate, others switch because their neighbors are doing it, or because they find joy in saving energy, and we're doing it now!At Eneco, we want to help everyone to take the next sustainable step. And we are looking for the best people who can make that possible. People who are enthusiastic about our mission of 'sustainable energy for everyone' and who want to further develop their talents at Eneco. We want everyone to be able to participate effortlessly in the energy transition. This can only happen if we better assist our customers, remove barriers for them to become more sustainable by listening and understanding their true needs.Digital innovations help the market align supply and demand and make it as easy as possible for users. Data plays a crucial role in this. From the Data & Technology Services department, we are working to make Eneco a data-driven organization that bases its decisions and actions on customer, product, asset, and market data.What You’ll DoIn Data & Technology Services, the Data Services department is responsible for executing data projects for the Business and fueling the growth of data capabilities by acting as an incubator for the development of data products.As Data engineer you have an essential role in transforming Eneco's projects into stable, robust productionized data driven applications. The data engineer deeply understands how data pipelines behave in production, and uses this knowledge to enable implementation, optimization, and maintenance of complex data flows. You are an enabler who plays a pivotal role in the 'democratization' of data: you help to retrieve, store, transform and disclose data for use in data driven solutions.Is this about you?You get energy of solving complex issues with ingestions, but you do not lose sight of being able to properly maintain the ingestions. Where necessary, you coach your colleagues in realizing and maintaining ingestions.At least 5 years of relevant work experience in a Data Engineering role.Academic work and thinking level.Experience in continuous integration and continuous delivery, Snowflake or other data cloud solutions, SQL, Databricks, Docker, Azure Data Factory, Airflow, Python.Knowledge of concepts/components such as warehouse, data lake, data mesh, data vault, data fabric, and streaming solutions.You’ll be responsible forBuilding and maintaining data pipelines, note that this may require working in the evening or weekend.Stay up to date with the latest technologies to deliver the most efficient solutions for the business.Support the team in learning new technologies.Advice the organization in the best suitable solution to retrieve, store, transform and disclose data.This is where you’ll workData & Technology Services has multiple departments the Data Services department has two teams - a Data Management Services team and a Data Product Services team. You will be part of the Data Product Services team that assist the business in using the various parts of the Enterprise Data Platform effectively to create customer and business value.What We Have To OfferGross year salary of between €70.000 and €90.000 Including 8% holiday allowance, a good pension and parental leave.FlexBudget on top of your gross salaryHave it paid out, use it to buy extra holiday days or save it up for something nice - it's up to you.Personal and professional growthEneco is fully committed to help you in your personal and professional development.Hybrid working, at home or in the officeYou work 40% at the office and 40% at home. The other day you decide what works best for you.Working at Eneco is for everyoneOur customers are diverse, and so are we. More than 3,000 Eneco-talents ensure an open, pleasant culture in which everyone can grow and thrive. In this way we create the ideal situation for creative insights and innovative solutions. And we can use that to achieve our ambitious mission: to be climate neutral by 2035. You know what the fun is? We can never have enough talent at Eneco. So get in touch and apply.Together towards climate neutralityAsk a colleague about our joint mission and you will hear it again and again: Eneco wants to be climate neutral by 2035. Everyone works together to realize this ambition. We help customers switch to sustainable energy with good advice and smart, affordable products. We develop wind farms, install large solar roofs and invest in heat networks. We see opportunities everywhere. Are you in?This Is How The Application Procedure GoesWant to know more about this job function?Do you want to know more about this vacancy? Marcel van der Voort, our Manager Data Product Services, will be happy to answer your questions at 06 3401 9293. For more information about the recruitment process, please contact Mark van Dommelen, Recruiter Data & Technology at: 06 2918 5218.We do not appreciate acquisition in response to this advertisement.Questions About The Application ProcedureFeel free to contact our recruiter:Mark van Dommelen+31629185218Stuur een e-mailWith this job opening, we want to recruit a new Eneco colleague ourselves. This is not a call for acquisition.",analytics engineer
