job_url,site,title,company,company_url,location,job_type,date_posted,interval,min_amount,max_amount,currency,is_remote,num_urgent_words,benefits,emails,description,search_term
https://www.linkedin.com/jobs/view/3735363645,linkedin,Data Scientist,AS Watson Benelux,https://nl.linkedin.com/company/aswatson-benelux,"Renswoude, Utrecht, Netherlands",fulltime,2023-10-10,,,,,,0,,,"Dit ga je doenWeet jij als geen ander trends en patronen te ontdekken in onze (klant)data of ben jij een ster met time-series forecasting of ML modellen om het assortiment goed te verdelen? Dan zoeken we jou om ons Data Science team te versterken! Als Data Scientist ben je onderdeel van het Data Analytics team voor Kruidvat (Nederland en België) en Trekpleister. Samen met de andere Data Scientists en collega’s uit het team (Data Consultants, Data Analisten en Data Engineers) werk je aan uiteenlopende projecten op het gebied van forecasting, logistieke planning, assortiment optimalisatie, e-commerce en CRM. Door het ontwikkelen van slimme data-oplossingen ben je in staat de interne klant te helpen met concrete inzichten of adviezen op basis van jouw algoritme of analyse. Als grootste Health & Beauty retailer in de Benelux hebben we een schat aan data die we kunnen gebruiken. Elke week worden we bezocht door meer dan 4 miljoen klanten in onze ruim 1500 winkels en op de webshops. Ruim de helft van onze klanten is lid van de Kruidvat Club waardoor we onze klant steeds beter leren kennen.Wat ga je doen in de functie van Data Scientist?Je ontwikkelt data science oplossingen in Databricks en Azure die de business handvatten geeft om direct bij te kunnen sturen.Je ontwikkelt predictive- en prescriptive-modellen met grote, gecombineerde datasets. Hierbij werk je samen met je directe collega’s, maar ook met je collega’s van CRM, Inkoop, Marketing en eCommerce. IT is hierbij je beste vriend. Samen brengen jullie de oplossing tot leven.Je denkt mee en draagt actief bij aan de ontwikkeling van onze technologie en tooling dmv het ontwikkelen van bijvoorbeeld een utility package of het verder ontwikkelen van MLOps methodiek.Je blijft mee ontwikkelen op de innovaties binnen data science en stelt vast hoe we hiermee invulling kunnen geven aan onze ambities.Als organisatie investeren we fors in het neerzetten van een state-of-the-art analytics landschap. Als Data Scientist word jij binnen A.S. Watson Benelux (o.a. Kruidvat, Trekpleister) gezien als expert en dé aangewezen persoon om naar toe te gaan met vragen over modellen en statistiek. Solliciteer snel en 'become part of more'!Dit krijg je ervoor terugEen snelle omgeving waarin je veel kunt leren. En werkplezier door verantwoordelijkheid, vrijheid en de ruimte om jezelf te ontplooien. #bepartofmore Best belangrijk: een goed salaris! Afhankelijk van jouw ervaring en opleiding start je tussen de € 4.300,- en € 6.500,- bruto per maand bij een 40-urige werkweek. Plus personeelskorting bij Kruidvat, Trekpleister en ICI PARIS XL! 24 vakantiedagen en een aantrekkelijke ATV-regeling met 19,5 dagen op fulltime basis. Liever meer vrije tijd of extra geld? Koop of verkoop vakantiedagen of laat je ATV (deels) uitbetalen. Volop ontwikkelings- en doorgroeimogelijkheden met onze eigen A.S. Watson Academy. Bij A.S. Watson sta je nooit stil.Goede thuiswerkmogelijkheden. Hybride werken is bij ons heel gewoon en gaat altijd in goed overleg. Gemiddeld zul je 3 dagen op kantoor zijn. Dit ben jijJe hebt een afgeronde opleiding op WO-niveau. Je bent MSc op kwantitatief vlak, bijvoorbeeld Econometrie, AI, Statistiek, Wiskunde, etc.Je hebt minimaal 4 jaar ervaring als Data Scientist. Je expertise ligt bij SQL en diverse Python packages zoals Pandas en SciKit-learn.Je hebt ervaring met het in productie zetten van modellen Werken in scrums in Jira is je bekend.Kennis van Databricks, Azure of PySpark is een pre, evenals basis kennis van BI tools als Tableau of BO. Je ben in staat om met overtuiging je (technische) werk en de uitkomsten helder uit te leggen aan de interne klant. Verder vind je het leuk om met je collega Data Scientist te sparren over mogelijke oplossingen, PRs op te pakken en mee te helpen aan de verdere professionalisering van onze afdeling.Je werkt netjes en gestructureerd en werken met Git is business as usual.Omdat je internationale contacten hebt, beheers je naast het Nederlands ook het Engels goed in woord en geschrift.",pyspark
https://www.linkedin.com/jobs/view/3761141768,linkedin,"AWS Data Engineer - Senior Consultant - (Amsterdam Based, Hybrid Model)",GO IT by PTC Group,https://pt.linkedin.com/company/goitconcept1,"Amsterdam, North Holland, Netherlands",fulltime,2023-11-08,,,,,,0,Actively Hiring,,"GO IT Concept is a Portuguese technological start-up based in the interior of Portugal, in the beautiful city of Seia, Serra da Estrela. We have offices in Portugal and Brazil, to help our clients put tech talented teams at the heart of their business. Our goal is to disrupt things not just on the business front, but also building cultures that are affirming and inclusive. Building a diverse and inclusive organisation is a complex process requiring multiple elements to come together. This is why we need you to come on board and be part of this amazing journey.GO IT Concept is more than technology, is about work-life integration, is about helping the interior to grow and thrive, promoting local development with respect to traditions and way of living. This is an intangible journey too.We are looking for a AWS Data Engineer - Senior ConsultantNote: Candidates based in the Netherlands (hybrid work – 1/3 days per week in the client´s office in Amsterdam) OR candidates based nearshore, willing to travel to the client's office in Amsterdam whenever necessary.The selected candidate will be developing Data Pipelines as per requirements. Will also need to design and execute unit testing following the client´s development principles.Mandatory Skills:AWS Data Engineering - Lambda, Glue, Athena, S3, Cloudwatch, AWS CDK/Cloudformation, SNS, SQS, Almost all the common services that are usedPython & PySparkRole Description Skills:Scrum/Agile project delivery experienceAWS Data Engineering - Lambda, Glue, Athena, S3, Cloudwatch, AWS CDK/Cloudformation, SNS, SQS, Almost all the common services that are usedPython & PySparkExperience in Data modellingCandidates based in the Netherlands (hybrid work – 1/3 days per week in the client´s office in Amsterdam) OR candidates based nearshore, willing to travel to the client's office in Amsterdam whenever necessaryWhat you can expect from GO IT Culture:We promote cultures that are affirming and inclusive – recruiting the best tech talented engineers around the world;We promote cooperation and collaboration enhanced by trust , respect and diversity;We are intellectually curious – we love to learn, so that´s why we invest in learning and development;We are made of entrepreneurs: a moment where any employee can question, suggest or share any topic live with our co-founder & Managing Director;We promote communication channels where everybody knows every colleague and knows who is who;We give real time feedback, to improve your journey, and feedforward – your future skills preparing our employees for the future possibilities in the organization;We take mental health very seriously. Too much to handle? Need re-energize? Open talks directly to our Managing Director to support you and advise you to take some time-off and re-load your energy. Our Managing Director is a highly promoter of discussing openly mental health issues and totally support;We celebrate every moment of our journey and we are always grateful for who we are;We practice consciousness leadership – inspiring leadership such as: coaching and mentoring sessions by our own Managing Director to promote a great place to work and share it with the world, so all our employees can be proud of;We have a referral program that financially recognizes our employees for helping the company growth;We’ve created a new concept for leadership and management – once a year we have a moment where information about the company's performance is shared, crystal clear and where we discuss short-term prospects for the future;We believe great companies are made of ideas that can help to innovate, the company and our client’s business – we promote a monthly moment to gather ideas and transform them into business opportunities;We hold informal meetings to promote knowledge sharing moments between our employees and the technological community.We love some good socializing moments and we hold as many as we can, from monthly themed meetings to family events, we never say no to a good party.We are an equal opportunity employer. All applicants will be considered for employment without attention to race, colour, religion, sex, sexual orientation, gender identity, national origin, veteran or disability status.To Acess ourPowered by JazzHRRGX2mOLXGz",pyspark
https://www.linkedin.com/jobs/view/3755259328,linkedin,Data Scientist,Centric,https://nl.linkedin.com/company/centric,"Almere, Flevoland, Netherlands",contract,2023-11-03,,,,,,0,Be an early applicant,10787730ferdinand.neijndorff@centric.eu,"OrganisatieBij Centric Software Professionals ondersteunen we Ministeries, Banken/Verzekeraars en andere grote organisaties bij het aanpakken van technische en functionele uitdagingen. Ons team van 180 collega's bestaat uit Microsoft/Java-ontwikkelaars, software testers, business intelligence consultants, (data)analisten/wetenschappers, technisch applicatiebeheerders, infrastructuurspecialisten en Support Engineers.Als organisatie zijn we hecht en informeel en we investeren in onze medewerkers. We willen namelijk dat jij tevreden bent en met plezier naar je werk gaat om te doen waar je goed in bent. We bieden persoonlijke begeleiding op het gebied van je dagelijkse werkzaamheden en loopbaanontwikkeling.Ja, we werken hard, maar we zorgen ook voor ontspanning. We organiseren regelmatig sociale activiteiten zoals borrels, barbecues, game-avonden en hackathons. En als je van sporten houdt, kun je deelnemen aan onze actieve fiets- of hardloopclubs om je spieren los te maken.FunctiebeschrijvingAls Data Scientist bij Centric sta je bij grote klanten in, of in de omgeving van, je woonplaats (max 1 uur reistijd) terzijde bij het verzorgen van managementinformatie en het slim gebruiken van data. Het gebruik van (big)dataplatforms en -systemen leidt tot innovatie en datagedreven producten en diensten waardoor Centric haar klanten een steeds betere service kan verlenen, de impact en effectiviteit kan verhogen en kan bijdragen aan de ontwikkeling van mensen en teams.Als Data Scientist ben jij het technisch inhoudelijke aanspreekpunt voor klanten en collega's waar je door jouw sterke interesse in data, gecombineerd met jouw drive om nieuwe ontwikkelingen binnen de data science wereld te volgen, in staat bent om innovatieve oplossingen in een operationele omgeving te implementeren. Naast gepassioneerd over data ben je communicatief vaardig, zodat je een duidelijke toelichting kan geven aan collega's en klanten over jouw werk en de bijbehorende resultaten. Je voert afwisselende opdrachten uit binnen diverse branches zoals zorginstellingen, zakelijke dienstverlening en de (semi) overheid. Je hebt hierin een belangrijke en adviserende rol en voorziet het management van advies rondom de projecten.Daarnaast houd jij je bezig met het verder ontwikkelen en uitbouwen van het Data science portfolio, waarin het ontwikkelen en operationeel houden van de algoritmes en producten een vooraanstaande rol speelt. Verder ben je verantwoordelijk voor het opzetten en implementeren van Machine Learning en AI ten behoeve van rapportagevormen en analytics.Functie-eisenJe hebt ten minste een opleiding in de exacte wetenschappen HBO/WO studie afgerond, zoals (bedrijfskundige) Informatica, Wiskunde, Technische Bedrijfskunde of natuurkunde.Minimaal 5 jaar relevante werkervaring als Data Scientist of in een relevant vakgebied.Aantoonbare ervaring met cloud platform/cloud computing. Azure of AWSErvaring met agile/scrum/DevOps in de context van data science projectenGoede kennis van machine learning methodieken en algoritmes (decision trees, KNN, logistic regression). Uit kunnen leggen welke technieken het best zijn te gebruiken op een business casus.Aantoonbare ervaring met Python (incl versiebeheer en styleguides) en verschillende Python data science packages (NLTK, NumPy, Pandas).Ervaring met andere talen en tooling: PySpark, PyCharm, GIT, DevOps, SQL, DataBricksArbeidsvoorwaardenUitdagende opdrachten bij verschillende mooie klanten, waarbij we rekening houden met je woonplaats en maximaal 1 uur reistijdCoaching on the job en individuele carrièreplanning in samenwerking met je Talent Development ManagerEen salaris afhankelijk van jouw kennis én ervaring tot maximaal €5.500,00Uiteraard bieden we je een goed salaris en ook een prettig secundair pakket bestaande uit:Een flexibel mobiliteitsbudget, waarbij je de keuze hebt voor een leaseauto met tankpas (ook voor privégebruik én in buitenland), kilometervergoeding of ovEen persoonlijke bonus die maandelijks wordt uitgekeerdEen volledig betaalde pensioenregeling26 vakantiedagen met mogelijkheid tot bijkopenUitgebreide mogelijkheden voor technische en softskill trainingen- en opleidingenMeer informatieFerdinand Neijndorff+31 6 10787730ferdinand.neijndorff@centric.eu",pyspark
https://www.linkedin.com/jobs/view/3684544507,linkedin,Data Engineer,ITSync,https://nl.linkedin.com/company/itsync-bv,"Amsterdam, North Holland, Netherlands",fulltime,2023-08-04,,,,,,0,Actively Hiring,,"Our ClientAs a data engineer at ABN AMRO, you'll join a leading bank with a strong commitment to providing exceptional financial services and sustainable banking. We value your growth and work-life balance, offering continuous learning opportunities and encouraging personal projects. Our customer-centric approach and data-driven insights ensure the best banking experience for clients. Join us in shaping the future of finance through transformative data engineering projects that make a positive impact on society, while creating value for clients, employees, and the community.Job DescriptionAs a member of our Data Engineering team, you will be involved in the full lifecycle of the data process. Your responsibilities will include collecting, loading, preparing, cleaning, and delivering large and diverse datasets. Building, monitoring, and maintaining pipelines will be essential to ensure smooth data flow. Additionally, you will play a key role in optimizing data delivery, as well as identifying opportunities to enhance data quality and efficiency. Collaboration is vital in our team, and you will actively align and work closely with stakeholders, product owners, and data architects. We value continuous improvement, and your drive to enhance your expertise will be highly valued. You excel in sharing knowledge with team members, contributing to problem-solving, and expressing your ideas. With a strong focus on delivering results, you embrace challenges with determination and strive to make a meaningful impact.The Ideal Candidate Will Have5+ years of data engineering experienceexpertise in Python, Spark, and SQL for data collection and analysisproficiency in Azure cloud platform, including Azure Databricks, Functions, and DevOps for data processingskills in building ETL pipelines using PySpark librarya proven track record in data modeling for data warehousingfamiliarity with distributed systems and CI/CD pipelinesknowledge of Power BI and Data Factory is a plusto be eligible for this position, applicants must have the right to work in the Netherlands , which can be fulfilled by being an EU citizen or holding a valid NL work permit.Who Are WeITSync & ABN AmroABN Amro selected ITSync as one of their preferred partners for finding (and sometimes relocating) highly skilled IT staff. All the assignments are contract-to-perm, which means that after the duration of the contract, you’ll have the opportunity to join ABN Amro permanently. Of course, this depends on both you and your ABN managers. In the contract duration, we’ll take care of you! We’ll help you out with all things necessary for relocating, living, and working in the Netherlands, for yourself and optionally your family. Our commitment to you is you’ll be able to start working Monday 9 am and don’t need to worry about anything else then your new job. If you’re looking for a stable a long-term challenge, please consider that 92% of our consultants will be offered a permanent contract directly from ABN Amro after the initial project assignment.What We Offerinitial 12-month-assigment with extension possibility36 hour work weekhybrid workingtransit and/or working from home allowanceinternet allowance€4.700,00 - €6.700,00 gross per month (depending on experience)holiday payment (8,33% on your gross annual income) and 13th-month (bonus) payment25 paid holiday days (based on 40-hour week)full pension contributionto be eligible for this position, applicants must have the right to work in the Netherlands, which can be fulfilled by being an EU citizen or holding a valid NL work permit",pyspark
https://www.linkedin.com/jobs/view/3753407644,linkedin,Data Analyst | CHDR - Centre for Human Drug Research,Cooder,https://nl.linkedin.com/company/cooderjobs,"Leiden, South Holland, Netherlands",fulltime,2023-11-01,,0,0,€,,0,Actively Hiring,,"Do you want to work as a Data Analyst within a dynamic company such as CHDR? Then don't hesitate to apply and we'll talk to you soon!The listingYou will be part of the Biomarker Engineering and Analytics department (BEA). Your colleagues at the BEA department consists of research professionals with a range of backgrounds and expertise in electrical engineering, biomedical engineering, technical medicine, data science, and (cognitive) neuroscience. The department is engaged primarily in the development of new measurement methods generating biomarkers that are used to quantify drug effects in human volunteers. Furthermore, the combination of biomarkers (features) with Machine Learning can lead to new insights and a new (compound) biomarker.As a data analyst at CHDR, you will have the opportunity to contribute to research projects that focus on the development and validation of novel clinical biomarkers. Data analysts facilitate the process of collecting, cleaning, visualizing, and analyzing clinical trial data. The developed data pipelines can be used for the development of new drug applications, treatment methods, device testing, and other applications where data gathering is necessary to determine patient outcomes. As this work requires collaboration and expertise across disciplines, data analysts at CHDR regularly work with both internal and external researchers (e.g., clients). Given these objectives, our data analysts are expected to perform the following tasks:Develop, validate, and apply (novel) techniques for preparing, analyzing, and summarizing data into research results, Prepare reports and manuscripts and assists with the development and presentation of materials, Serve as an initial point of contact for individuals and groups providing basic information about result analysis and methodologies, Build predictive models to forecast patient responses, classify diagnoses and treatment effects, and to estimate symptom severity, Apply machine learning techniques to identify potential (composite) biomarkers that can help predict treatment responses and/or efficacy, Apply machine learning algorithms for image analysis or other data types to extract insights that aid drug development Hier gaan we vanuitWe are looking for someone with a master’s degree in Computer Science, Engineering, or related degree. You have demonstratable experience in (applied) machine learning in Python (ideally using pandas, numpy, and sklearn libraries). You have strong problem-solving skills and excellent verbal and written communication skills. We prefer that our new colleague has experience with PySpark, and/or SQL. Next to that, we prefer experience with time-series analysis and/or image processing. Familiarity with clinical data and/or health informatics is a bonus. The candidate should have experience using statistical computer languages (mainly Python) to manipulate and analyze datasets. A strong candidate should have knowledge in the applications, strengths, and weaknesses of a variety of machine learning techniques (such as random forests, linear discriminant analysis, logistic regression etc.). We are also interested in hiring candidates who are potentially interested in pursuing a PhD, as CHDR can support ambitious young researchers through a PhD program. ArbeidsvoorwaardenYou will join a dynamic, passionate organization and work within a diverse team in a fast-paced, innovative setting. We offer you a pleasant hybrid workplace with an open multidisciplinary work environment and good secondary employment conditions such as an end of year bonus, development opportunities and all kinds of social events. About CHDR - Centre for Human Drug Research:CHDR is an independent institute specializing in innovative, early-stage clinical drug research (www.chdr.nl). By combining cutting edge methods and technologies, state-of-the-art facilities, and talented researchers, we help maximize our clients’ success. We are located in Leiden, the Netherlands, and collaborate closely with the University of Leiden and the clinical departments of the LUMC. CHDR stands for scientific quality. We stand for deepening, innovation and collaboration. Employees and test subjects feel at home at CHDR. We deliver top quality in clinical research and are constantly innovating. CHDR employs more than 350 people and we conduct an average of 45 studies per year. By working closely with colleagues, you make use of each other's specialisms so that our customers receive the right service and you and CHDR develop further.Founded in 1987Present in the sector of Informatiediensten.The average age is 37.Currently working in 1 office.",pyspark
https://www.linkedin.com/jobs/view/3645684896,linkedin,Data Engineering Intern,Metyis,https://ch.linkedin.com/company/metyis,"Amsterdam, North Holland, Netherlands",internship,2023-11-24,,,,,,0,Actively Hiring,,"Who We AreWe are Metyis, a forward-thinking, global company that collaborates with business partners and clients to create and implement the capacities and capabilities required to improve future performance. We operate across a wide range of industries, and with our embedded partnership model we commit to driving sustainable growth for industry-leading organisations, elevating their potential with a long-term vision.At Metyis, we develop integrated solutions that enable growth by working within our business partners’ organisations with diverse and multidisciplinary teams. This collaborative environment allows Metyis to build strategies and execute them through an ecosystem that combines Big Data solutions, Digital Commerce solutions, Marketing & Design solutions, and Advisory services.Our teams are set up so that you have plenty of room to build bigger and bolder ideas by speaking your mind and being creative with your knowledge. Imagine the things you could achieve with a multidisciplinary team that encourages you to be the best version of yourself.We are Metyis. Partners for Impact.What We Offer3 months of intensive training from our super skilled Data engineering team on topics like data warehousing, data pipelines, distributed computing using Pyspark, data modelling & data lake.Followed by 3 months of relevant working experience on a live business case.Interact with clients regularly to drive their business towards impactful change.Play a key role in the team by creating new business solutions via data-driven insights.Receive guidance by a dedicated mentor to make sure you make the most out of your time at Metyis.Experience being part of a fast-growing international and diverse team.What you will doAssisting in the design, development, and maintenance of data pipelines to extract, transform and load data from various sources.Helping with data warehousing and data modelling activities.Participating in the creation of data-driven solutions to support business needs.Collaborating with data scientists, business analysts and software engineers to understand and implement data requirements.Implementing data quality and data governance processes.Participating in code reviews and providing constructive feedback.Staying up to date with the latest developments in data engineering technologies and best practices.What you’ll bringPursuing a degree in computer science, software engineering, or a related field.Strong programming skills in one or more programming languages such as Python, Java, or Scala..Strong analytical and problem-solving skills.Ability to work well in a team environment.Good communication and interpersonal skills.Passion for Data: A strong interest in data and technology, and a desire to learn and grow as a data engineer.",pyspark
